{
  "$schema": "../../../../schemas/lab.schema.json",
  "schemaVersion": 1,
  "type": "project",
  "language": "cpp",
  "toolchain": {
    "standard": "c++17",
    "profile": "course-default"
  },
  "buildSystem": "cmake",
  "tasks": [
    {
      "id": "transpose",
      "path": "tasks/task-01-transpose",
      "weight": 40,
      "kind": "stdio",
      "dependsOn": []
    },
    {
      "id": "ops",
      "path": "tasks/task-02-ops",
      "weight": 40,
      "kind": "ctest",
      "dependsOn": ["transpose"]
    },
    {
      "id": "report",
      "path": "report",
      "weight": 20,
      "kind": "manual",
      "dependsOn": ["ops"]
    }
  ]
}
