{
  "$schema": "../../../schemas/lab.schema.json",
  "schemaVersion": 1,
  "type": "program",
  "language": "cpp",
  "toolchain": {
    "standard": "c++17",
    "profile": "course-default"
  },
  "targets": {
    "student": {
      "sources": [
        "student/main.cpp"
      ],
      "includeDirs": []
    },
    "solution": {
      "sources": [
        "solution/main.cpp"
      ],
      "includeDirs": []
    }
  },
  "judge": {
    "kind": "stdio",
    "cases": "tests/cases.json",
    "compare": {
      "mode": "tokens"
    },
    "limits": {
      "timeMs": 2000,
      "outputKb": 1024
    }
  }
}
